{
  "schema_version": 1,
  "flow_id": "3fa9c1d2e4b50761",
  "host_id": "a1b2c3d4e5f60718",
  "kind": "window",
  "ts_ns": 46250000000,
  "ip_version": 4,
  "protocol": 17,
  "src_port": 51820,
  "dst_port": 3478,
  "pkt_sizes": [128, -112, 1100, 1100, -980, 1100, -1012, 1100],
  "pkt_gaps_us": [18400, 2100, 310, 19800, 420, 20100, 380],
  "window": {
    "samples": 5,
    "pkts_up_per_s": 148.2,
    "pkts_down_per_s": 151.6,
    "bytes_up_per_s": 151164.0,
    "bytes_down_per_s": 147810.0,
    "mean_pkt_size_up": 1020.0,
    "mean_pkt_size_down": 975.0,
    "pkt_size_spread": 31.4,
    "rate_cv": 0.06,
    "burstiness": 1.12
  }
}
